{
  "schema_version": 1,
  "payload": {"type": "json", "value": null},
  "occurred_at": "2026-09-23T08:00:00Z",
  "labels": {},
  "attributes": {},
  "extension": {
    "schema_ref": "schemas/extensions/example.schema.json",
    "schema_digest": "sha256:aaaaaaaaaaaaaaaaaaaaaaaaaaaaaaaaaaaaaaaaaaaaaaaaaaaaaaaaaaaaaaaa",
    "data": null
  },
  "tree": {
    "name": "root",
    "children": [{"name": "leaf", "children": []}]
  },
  "safe_integer": 0
}
